{
  "$schema": "https://json-schema.org/draft/2020-12/schema",
  "$id": "urn:quorum:schema:quorum-policy-1.schema.json",
  "title": "quorum-policy/1",
  "description": "The trust decisions a verifier applies to a quorum/1 envelope. Every field is required: a policy with an omitted field would default to something, and a defaulted governance decision is how a gate becomes decoration.",
  "type": "object",
  "additionalProperties": false,
  "required": [
    "schema",
    "policy_version",
    "accepted_verdicts",
    "require_family_inequality",
    "require_family_trust",
    "require_pr_binding",
    "require_evidence",
    "require_residue_declaration"
  ],
  "properties": {
    "schema": {
      "const": "quorum-policy/1"
    },
    "policy_version": {
      "type": "string",
      "description": "<label>+<identity>, where identity is the first 128 bits of sha256 over the canonical bytes of this document WITHOUT policy_version. Two materially different policies therefore cannot share one policy_version, and Q20_POLICY_IDENTITY recomputes it: the suffix is checked, not trusted. JSON Schema cannot compute a digest, so this pattern constrains only the SHAPE.",
      "pattern": "^[a-z][a-z0-9-]*/[0-9]+@[0-9]{4}-[0-9]{2}-[0-9]{2}\\+[0-9a-f]{32}$"
    },
    "accepted_verdicts": {
      "type": "array",
      "minItems": 1,
      "uniqueItems": true,
      "items": {
        "type": "string",
        "pattern": "^[A-Z][A-Z _]{1,30}[A-Z]$"
      },
      "description": "The closed set of verdict tokens this policy recognises. Anything outside it is refused; there is no permissive default."
    },
    "require_family_inequality": {
      "type": "boolean",
      "description": "Cross-family review: author_family != reviewer_family. Settable to false only for a deliberately non-independent policy, and the verifier says so in its output."
    },
    "require_family_trust": {
      "type": "string",
      "enum": [
        "declared",
        "observed"
      ],
      "description": "The MINIMUM trust level both families' evidence must reach. Under 'observed', an envelope carrying 'declared' evidence \u2014 which is what a yaml registry field is \u2014 fails closed."
    },
    "require_pr_binding": {
      "type": "boolean"
    },
    "require_evidence": {
      "type": "boolean",
      "description": "When true the verifier must be handed the review evidence document and recompute its digest. Deleting the evidence then fails the check instead of skipping it."
    },
    "require_residue_declaration": {
      "type": "boolean",
      "description": "Require review.residue. Like every other require_* key this is MANDATORY to state \u2014 there is no permissive default, because a policy that is silent about residue is how a verdict quietly becomes a score again."
    }
  }
}
